{"component_id":"leakage-safe-model-comparison-gate","version":"1.0.0","status":"SPECIFICATION_DRAFT","decision_source":"DECISION-COMPONENT-READINESS-002D-R1","accepted_scope":"SPECIFICATION_ONLY","purpose":"Specify a deterministic fail-closed gate for leakage-safe validation selection and one-time sealed-test evaluation, with every decision bound to one Run ID and immutable evidence.","observed_gap_ids":["REPEATED_POLICY_COMPLIANCE_GAP"],"supporting_evidence_ids":["PHASE-002D-R1-EVIDENCE-SCOPES-001"],"non_goals":["Implement or execute a component, model, experiment, or shadow prototype.","Select or recommend a current Phase 002D-R2 architecture or model.","Import upstream code, dependencies, schemas, prompts, state machines, or prose."],"clean_room_provenance":{"component_id":"leakage-safe-model-comparison-gate","source_inspirations":["kdense-scientific-agent-skills metadata-only mechanism card"],"source_commits":["f6fcafeb1cc8c82eca0160a18bc41c38427b8e0f"],"source_paths":[],"abstract_mechanisms_observed":["Predeclare comparisons, isolate final holdout data, and require baseline and diagnostic evidence."],"content_not_copied":["No upstream source file was opened.","No upstream code or dependency was copied.","No upstream schema, prompt, state machine, or prose was copied.","No peer output or expected conclusion was inspected."],"project_specific_design":["All splits, attempts, access events, and decisions bind to project Run IDs and immutable hashes.","Failed runs remain nonnumeric evidence and exposed holdouts are permanently demoted."],"license_status":"UNVERIFIED","allowed_reuse_mode":"REFERENCE_ABSTRACT_MECHANISM","contamination_status":"UNVERIFIED","independent_tests":["LCG-PUB-001"],"reviewed_by":["leakage-safe-model-comparison-gate-spec-author"],"provenance_hash":"0000000000000000000000000000000000000000000000000000000000000000"},"actors":["main agent as sole formal-state writer"],"inputs":[{"name":"comparison_bundle","type":"FrozenComparisonBundle","required":true,"description":"Run binding; objective; train, validation, and sealed-test splits; temporal and group rules; feature availability; naive and domain baselines; frozen candidates, metric, thresholds, tie rule, seeds, retries, robustness, ablations, attempts, model freeze, access ledger, and final-test batch.","authority":"main-agent freeze"}],"outputs":[{"name":"comparison_gate_record","type":"ComparisonGateRecord","required":true,"description":"Hash-bound PASS, REJECT, ABSTAIN, or STALE record containing selection replay, access findings, final-test disposition, reason codes, and affected dependencies.","authority":"deterministic adjudicator"}],"state_read_set":["frozen comparison bundle and dependency status"],"state_write_set":[],"schemas":["contracts/component_specification.schema.json"],"preconditions":[{"id":"LCG-PRE-001","statement":"Before score observation, freeze the Run binding, objective, train-validation-test membership, temporal boundaries, disjoint group keys, feature availability, candidates, naive and domain baselines, validation metric, thresholds, tie rule, seeds, retries, failure treatment, robustness, ablations, and append-only access-ledger genesis.","enforcement":"DETERMINISTIC","severity":"BLOCKER"}],"postconditions":[{"id":"LCG-POST-001","statement":"A PASS proves validation-rule selection, complete required evidence, zero revealing test access before model freeze, exactly one later final-test batch, retained failures and access history, stable hashes, and no formal-state or current-architecture selection by this component.","enforcement":"DETERMINISTIC","severity":"BLOCKER"}],"invariants":[{"id":"LCG-INV-001","statement":"Test records, labels, predictions, metrics, ranks, and failure patterns never influence generation, features, hyperparameters, thresholds, architecture, early stopping, retries, selection, or filtering; premature access invalidates the Run and requires a new sealed test set.","enforcement":"DETERMINISTIC","severity":"BLOCKER"},{"id":"LCG-INV-002","statement":"The winner is the frozen validation-objective optimum with only the frozen tie rule, while every failed run remains explicit and nonnumeric and every stochastic operation uses the frozen seed schedule.","enforcement":"DETERMINISTIC","severity":"BLOCKER"},{"id":"LCG-INV-003","statement":"Partitions are record-, group-, and time-safe, transformations fit training data only, target and future leakage are absent, required drift, robustness, uncertainty, randomization, and ablation evidence precedes model freeze, and final test executes once with all access evidence retained.","enforcement":"DETERMINISTIC","severity":"BLOCKER"}],"hard_failures":[{"id":"LCG-HARD-001","statement":"Any premature or ambiguous test access, partition overlap, future or target-derived feature, nontraining-fitted transformation, or broken access-ledger chain is a hard failure.","enforcement":"DETERMINISTIC","severity":"BLOCKER"},{"id":"LCG-HARD-002","statement":"Any validation-rule mismatch, missing baseline or required evidence, omitted or zero-scored failure, unscheduled seed or retry, post-freeze rule change, fallback selection, or second final-test batch is a hard failure.","enforcement":"DETERMINISTIC","severity":"BLOCKER"}],"warnings":[],"algorithms":[{"id":"LCG-ALG-001","kind":"PSEUDOCODE","specification":"Verify hashes, freeze order, split isolation, feature availability, training-only transforms, artifact completeness, seeds, failures, and access chain; aggregate each eligible candidate over frozen validation seeds with the frozen metric; form the frozen-tolerance tie set and apply frozen ordered tie keys; require the recorded model freeze to match; authorize one atomic final-test batch only after pretest PASS; apply frozen final thresholds without fallback; otherwise emit reason-coded REJECT, ABSTAIN, or STALE."}],"deterministic_enforcement":[{"id":"LCG-DET-001","statement":"Canonical hashes, identifiers, schemas, freeze order, overlaps, feature times, ledger links, access counts, required artifacts, and stale dependencies are checked without model judgment.","enforcement":"DETERMINISTIC","severity":"BLOCKER"},{"id":"LCG-DET-002","statement":"Eligibility, validation aggregates, metric direction, tie membership, tie resolution, selected-candidate equality, and final threshold relations replay only from frozen inputs, with no vote or compensating metric.","enforcement":"DETERMINISTIC","severity":"BLOCKER"}],"agent_responsibilities":["The main agent freezes authoritative inputs and alone updates formal state; producers append complete successes, failures, retries, and accesses; the adjudicator replays deterministic rules and abstains on missing evidence; an independent auditor verifies replay before acceptance."],"stale_propagation":[{"id":"LCG-STALE-001","statement":"Any changed input, split, feature, candidate, baseline, metric, seed, attempt, robustness result, model, environment, policy, or ledger predecessor marks all dependent selections, tests, audits, decisions, claims, and handoffs STALE from the earliest affected predecessor, and exposed tests cannot regain held-out status.","enforcement":"DETERMINISTIC","severity":"BLOCKER"}],"failure_modes":[{"id":"LCG-FAIL-001","trigger":"Test information is exposed before model freeze or a second final-test batch is attempted.","consequence":"The Run, test set, and dependent decisions are invalid.","recovery":"Retain all evidence and restart with a new Run and newly sealed test set."},{"id":"LCG-FAIL-002","trigger":"A required attempt fails or the ledger, selection replay, split, or evidence bundle is incomplete or inconsistent.","consequence":"The gate cannot pass and failures remain explicit nonnumeric outcomes.","recovery":"Before test exposure, append a versioned correction and replay all dependencies; after exposure, also replace the sealed test set."}],"recovery_behavior":[{"id":"LCG-REC-001","statement":"Recovery is append-only from an exact hash-verified predecessor; silent edits and retries are forbidden, and any revealing test access makes replacement of the test set and Run mandatory.","enforcement":"DETERMINISTIC","severity":"BLOCKER"}],"audit_events":[{"event":"COMPARISON_GATE_EVALUATED","when":"At pretest adjudication, final-test closure, invalidation, or replay.","payload_fields":["run_id","input_hashes","access_chain_head","selected_candidate_id","test_batch_count","decision","reason_codes","record_hash"]}],"security_constraints":["Test access is deny-by-default and limited to one hash-bound final batch after pretest PASS and model freeze.","No upstream or other third-party executable, dependency, prompt, schema, or tool declaration is imported or executed."],"privacy_constraints":["Ledgers use pseudonymous identifiers and expose only the minimum aggregates and failure metadata needed for deterministic audit."],"performance_budget":{"measurement":"Gate work over access events E, attempts A, candidates C, seeds S, and checks K.","limit_or_formula":"One bounded pass, O(E+A+C*S+K), with no unbounded search or retry.","hard":true},"token_budget":{"measurement":"Model tokens used by authoritative gate replay.","limit_or_formula":"0","hard":true},"maintenance_surface":["Versioned logical contracts, deterministic reason codes, replay rules, and conformance fixtures."],"interaction_dependencies":[],"interaction_conflicts":[],"public_conformance_tests":[{"test_id":"LCG-PUB-001","purpose":"Accept a complete leakage-safe record.","input_class":"Valid frozen bundle with disjoint splits, both baselines, complete attempts and diagnostics, validation-consistent winner, clean access chain, and one final batch.","expected_relation":"Process PASS is reproducible and the final verdict uses only frozen thresholds."},{"test_id":"LCG-PUB-002","purpose":"Reject held-out leakage.","input_class":"A test read, test-driven early stop, future feature, cross-split group, or validation-fitted transform appears.","expected_relation":"T